http://finance.people.com.cn/n1/2022/0530/c1004-32433681.html,我国信息通信业迎来由大向强的跃升,“我国信息通信业已经成为国民经济的战略性、基础性、先导性行业，在从小到大的基础上，迎来由大向强的跃升。”5月17日在内蒙古自治区呼和浩特市举办的2022年世界电信和信息社会日大会上，工业和信息化部副部长张云明说。 党的十八大以来，我国信息通信业取得了历史性成就，有效满足了广大人民对美好生活的向往，有效驱动实体经济数字化、网络化、智能化转型升级，有效支撑国家治理体系和治理能力现代化水平提升，有效推动了经济社会高质量发展。  目前，我国已建成5G基站近160万个，建成全球规模最大的移动宽带和光纤网络，网络规模全球领先。 统计表明，我国光纤用户占比由2012年的不到10%提升至2021年的94.3%，固定宽带由百兆迈向千兆跨越升级。网络架构持续优化，打造了“全方位、立体化”的网络布局，网络质量达到甚至优于欧美发达国家水平。 网络能力演进升级，IPv6普及应用达到国际先进水平。截至2022年3月，我国IPv6活跃用户数占全部网民数的63.01%，已申请的IPv6地址资源位居世界第一。云网协同、算网融合持续演进，算力、算法、数据协同的一体化数字基础设施体系加快构建。 技术产业更加成熟壮大，重点领域实现世界领先。在关键技术创新方面，我国从“3G突破”“4G同步”，走向“5G引领”；5G芯片、移动操作系统等关键核心技术与国际先进水平差距持续缩小，我国企业声明的5G标准必要专利数量保持世界领先。 产业体系日臻完善，新兴领域跻身一流。据介绍，我国通信设备、智能终端、计算机等产业链竞争力明显增强，光通信设备、国产智能手机占据全球半数份额，带动处理芯片、存储芯片、显示屏等上游环节协同突破，产能、营收和利润保持世界领先。  “我国已形成全球最大、最活跃的数字服务市场。”张云明说，创新应用更加广泛深入，生活生产实现深度覆盖，消费领域拓展了数字生活新空间。 其中，我国电子商务销售额全球占比从2012年的8%提升至2021年的57%，成为全球最大市场；2021年，我国移动支付金额达到527万亿元，较2012年增长了227倍。5G应用涵盖交通、医疗、教育、文旅等诸多生活领域。 生产领域催生数字经济新动能。工业互联网创新发展战略深入实施，从无到有建成网络、平台、安全三大体系，走出一条“建设与应用相协调、发展与安全相统筹、补课与创新相并行”的中国特色发展道路，迈入全球前列。工业互联网已应用于45个国民经济大类，涵盖研发设计、生产制造、营销服务等各个环节，产业规模迈过万亿元大关。 近年来，我国连续组织实施了7批电信普遍服务试点工作，累计支持全国13万个行政村光纤网络建设和6万个农村4G基站建设，目前行政村通宽带比例提升到100%，贫困地区通信难问题得到历史性解决，数字便民实现普惠共享。 与此同时，科技适老成效显著，10余项适老化标准规范相继出台，375家老年人常用的网站、App均推出适老助老功能，基础电信企业“老年人一键呼入人工客服”服务超1亿人次。  张云明说，我国信息通信业行业管理水平持续提升，下一步全行业将融入经济社会发展各领域。 在基础设施建设方面，仍将统筹谋划、适度超前，系统化推进5G、千兆光网、数据中心建设，深化数网融合、算网融合和云边协同发展，提升覆盖深度和广度，打通经济社会发展的信息“大动脉”。 同时，将加快推进工业互联网提档升级；进一步提升数字惠民水平。特别是要深化电信普遍服务，继续面向农村脱贫户实施精准降费，拓展农村网络应用新业态新模式，助力乡村振兴；深入推进信息无障碍建设，实施适老化改造升级行动，助力老年人、残疾人等重点群体共享便利数字生活；响应群众“急难愁盼”，完善App全链条监管体系，纵深推进App侵害用户权益专项整治，切实加强用户个人信息保护；开展信息通信服务感知提升行动，持续提升5G服务质量。 会上，国际电信联盟秘书长赵厚麟通过视频致辞时说，当今世界，人类和技术的发展正处于一个转折点。在新冠肺炎疫情期间，全世界目睹了数字技术的能力及其改变我们未来的方式。从5G到物联网、人工智能和云计算，诸多领域的新兴数字技术正在突破可能的边界，与之前的其他突破性技术一样，它们将对人类和地球的未来产生深远影响。 “深化国际开放合作，拓展发展空间。”张云明表示，在5G/6G发展、工业互联网创新、数字鸿沟弥合等重点领域，我国仍将加强与国际的合作，携手打造开放、公平、公正、非歧视的数字发展环境，共建网络空间命运共同体，让数字化发展成果更好地造福人民、造福社会、造福世界。                                                                                                                    
http://finance.people.com.cn/n1/2022/0530/c1004-32433639.html,上海重振经济：拿出“真金白银”助企纾困 “缓免减退补”为企减负,上海29日出台《上海市加快经济恢复和重振行动方案》(以下简称《行动方案》)。该《行动方案》包括八个方面、五十条政策措施，全力助企纾困、复工复产复市、稳定三大需求(稳外资、稳外贸、促消费投资)、强化支撑保障。 中共上海市委常委、常务副市长吴清29日指出，政府要有效作为，尽最大努力拿出“真金白银”为企业纾困解难，帮助企业渡过难关，缓解燃眉之急，留住“青山”。 吴清说，接下来，最关键的是要抓好落实落地，为企业送去实实在在的助益。我们期待，通过政策助力和企业自身的努力，各类市场主体都能够有序复工复产复市，尽快恢复元气，重新焕发生机和活力。 上海市经济信息化委主任吴金城指出，上海将通过全面推进复工复产、落实好各项惠企举措、加快重大产业项目投资落地等，加速恢复产业链供应链正常运转，提升上海产业链、供应链竞争力。 上海市政府副秘书长、上海市发展改革委主任华源说，本轮《行动方案》提出的政策措施叠加3月底上海市政府出台上轮“21条”政策，预计全年将为市场主体减负各类资金规模达3000亿元(人民币，下同)。 华源介绍，对餐饮、零售、旅游、民航、公路水陆铁路运输5个特困行业，阶段性缓缴养老、失业和工伤保险费单位缴纳部分，上海将医疗保险费也纳入缓缴范围；通过物业业主让一点、市区财政补一点、“房土两税”减一点，努力放大房租减免政策效应。在已出台的制造业、科学研究和技术服务业等6个行业企业的存量留抵税额全额退还、增量留抵税额按月全额退还基础上，上海将在更多行业实施增值税存量和增量全额留抵退税。 据悉，上海将聚力支持疫情防控期间的稳岗就业，对不裁员、少裁员的困难行业企业，上海给予每人600元人民币一次性稳岗补贴，每户企业补贴上限300万元；对招录登记失业三个月以上人员或上海市2022届高校毕业生的用人单位，按每人2000元给予一次性吸纳就业补贴。 根据《行动方案》，上海将以大宗消费为抓手，年内新增非营业性客车牌照额度4万个，阶段性减征部分乘用车购置税；对置换纯电动汽车的个人消费者给予一次性10000元补贴，支持大型商贸企业和电商平台发放消费优惠券等以大力促进消费加快恢复。（陈静）                                                                                                                    
http://finance.people.com.cn/n1/2022/0530/c1004-32433659.html,研究表明：艾滋病药物可对抗中年记忆力减退,美国研究人员发现了记忆连接背后的关键分子机制。他们还确定了一种恢复中年小鼠大脑功能的方法，以及一种美国食品药品监督管理局(FDA)批准的艾滋病药物可达到同样的效果。近日发表在《自然》杂志上的该研究成果，提出了一种加强中年人记忆的新方法，或有助于对痴呆症进行早期干预。 人类大脑很少记录单一的记忆，相反，它们将记忆存储成组，这样对一个重要记忆的回忆就会触发其他与时间相关的记忆。然而，随着年龄的增长，人类大脑逐渐失去了连接相关记忆的能力。 加州大学洛杉矶分校大卫格芬医学院神经生物学和精神病学教授阿尔西诺·席尔瓦领导的团队，专注于一种名为CCR5的基因，该基因与搭艾滋病毒便车感染脑细胞并导致患者记忆丧失的基因相同。席尔瓦实验室在早期的研究中证明，CCR5的表达会降低记忆回忆能力。 在当前的研究中，席尔瓦团队发现了一种潜在的核心机制，即小鼠能够将它们对两个不同笼子的记忆联系起来。研究人员以微型显微镜作为进入动物大脑的窗口，观察神经元的放电及创造的新记忆。 提高中年小鼠大脑中CCR5基因的表达会干扰记忆联系，小鼠会忘记两个笼子之间的联系。当研究人员删除小鼠体内的CCR5基因时，小鼠能将无法连接的记忆联系起来。 席尔瓦此前曾研究过FDA于2007年批准用于治疗HIV感染的药物马拉韦罗。研究发现，马拉韦罗抑制了小鼠大脑中的CCR5。当研究人员给老年小鼠服用马拉韦罗时，这种药物复制了从它们的DNA中删除CCR5的效果，年长的动物能够再次连接记忆。 该发现表明，马拉韦罗可帮助恢复中年记忆丧失，以及逆转由HIV感染引起的认知缺陷。 研究人员下一步将组织以早期干预为目标的临床试验，测试马拉韦罗对早期记忆丧失的影响。一旦完全了解记忆力是如何下降的，研究人员就有可能减缓这一过程。(记者张梦然)                                                                                                                    
http://finance.people.com.cn/n1/2022/0530/c1004-32433653.html,雄安发放5000万元数字人民币消费补贴支持服务业发展,河北雄安新区管理委员会29日举办“促消费·惠民生”支持服务业发展措施启动仪式。据悉，为支持服务业发展，雄安新区将通过发放近5000万元数字人民币补贴，鼓励和扩大消费。 在雄安新区，数字人民币的应用日趋广泛，此次数字人民币补贴支持雄安新区餐饮店达300家，商超达1200家。 河北雄安新区管理委员会副主任吴海军表示，雄安新区这次助企纾困政策与数字人民币使用试点紧密结合起来，所有补助全部采取数字人民币红包发放，流程少，操作便捷，不仅可以推动数字人民币在雄安新区深度应用，而且可以更加方便民众、方便企业。 “考虑到新区不少居民已经或即将喜迁新居，我们专门设置了家电和家具补贴，每人最高可领取补贴1000元(数字人民币)。”吴海军说。 据中国人民银行雄安新区营业管理部党委副书记、常务副主任田军华介绍，雄安新区作为全国第一批数字人民币试点地区之一，自2019年试点开展以来，数字人民币应用于新能源汽车充电桩物物支付、公交双离线支付、光伏发电智能结算等场景均实现全国首创，安新县老河头数字人民币特色小镇、容城县罗萨大街数字人民币特色街区建设日趋完善。 截至目前，雄安新区已累计开立各类数字人民币收单场景超1.8万个，个人钱包超150万个、对公钱包超30万个，数字货币在雄安新区试点应用的广度和深度得到显著提升。(记者 崔涛)                                                                                                                    
http://gz.people.com.cn/n2/2022/0530/c222152-35292279.html,急难愁盼｜一条留言，让自闭症孩子的康复补助款有了着落,贵州省遵义市播州区一名网友最近遭遇的糟心事解决了。 该网友家的小孩今年五岁，三岁时到医院检查出了自闭症，一直在康复机构做干预治疗。 去年，该网友了解到，国家残联有自闭症康复相关补助，在遵义，该补助由市级残联每月补助300元，区级残联每月补助1200元。 到相关单位申请过后，去年12月份，该网友把孩子治疗的发票进行提交，市级残联也将7个月共2100元补助款按时打到了康复机构。 但让该网友发愁的是，区级残联的8400元补助一直没有着落。 康复款不到位，小孩就有可能得不到继续治疗。无奈之下，今年5月，该网友登录了人民网“领导留言板”，将事情经过陈述后，向遵义市相关领导求助。 “我实在是快走投无路了，能借的、能想的办法的都试过了，看到孩子康复课以来的进步，实在不想放弃他。”该网友在留言中说。 事情很快有了着落。这条留言，引起了遵义市人民政府的高度重视。遵义市人民政府办公室立即责成播州区政府调查核实。 经核实，网友留言的信息属实。同时，根据《遵义市残疾人联合会关于进一步开展好2021年残疾人康复救助工作的通知》规定：孤独症儿童康复训练补助标准为1200元/月，时间为10个月。各县（市、区）根据本地残疾儿童康复救助情况，以半年或一年为结算周期，自行与康复定点机构结算。 综合事实和相关规定，遵义市人民政府办公室回复该网友：应兑现孩子2021年在教育培训学校7个月康复补助金8400元，并于2022年5月20日将康复补助金打入了培训学校银行账户。                        
http://finance.people.com.cn/n1/2022/0530/c1004-32433677.html,记忆连接背后的关键机制找到,美国研究人员发现了记忆连接背后的关键分子机制。他们还确定了一种恢复中年小鼠大脑功能的方法，以及一种美国食品药品监督管理局（FDA）批准的艾滋病药物可达到同样的效果。近日发表在《自然》杂志上的该研究成果，提出了一种加强中年人记忆的新方法，或有助于对痴呆症进行早期干预。 人类大脑很少记录单一的记忆，相反，它们将记忆存储成组，这样对一个重要记忆的回忆就会触发其他与时间相关的记忆。然而，随着年龄的增长，人类大脑逐渐失去了连接相关记忆的能力。 加州大学洛杉矶分校大卫格芬医学院神经生物学和精神病学教授阿尔西诺·席尔瓦领导的团队，专注于一种名为CCR5的基因，该基因与搭艾滋病毒便车感染脑细胞并导致患者记忆丧失的基因相同。席尔瓦实验室在早期的研究中证明，CCR5的表达会降低记忆回忆能力。 在当前的研究中，席尔瓦团队发现了一种潜在的核心机制，即小鼠能够将它们对两个不同笼子的记忆联系起来。研究人员以微型显微镜作为进入动物大脑的窗口，观察神经元的放电及创造的新记忆。 提高中年小鼠大脑中CCR5基因的表达会干扰记忆联系，小鼠会忘记两个笼子之间的联系。当研究人员删除小鼠体内的CCR5基因时，小鼠能将无法连接的记忆联系起来。 席尔瓦此前曾研究过FDA于2007年批准用于治疗HIV感染的药物马拉韦罗。研究发现，马拉韦罗抑制了小鼠大脑中的CCR5。当研究人员给老年小鼠服用马拉韦罗时，这种药物复制了从它们的DNA中删除CCR5的效果，年长的动物能够再次连接记忆。 该发现表明，马拉韦罗可帮助恢复中年记忆丧失，以及逆转由HIV感染引起的认知缺陷。 研究人员下一步将组织以早期干预为目标的临床试验，测试马拉韦罗对早期记忆丧失的影响。一旦完全了解记忆力是如何下降的，研究人员就有可能减缓这一过程。（记者张梦然）                                                                                                                    
http://finance.people.com.cn/n1/2022/0530/c1004-32433683.html,大气中首次检测到新型极活泼化合物,据26日发表在《科学》杂志上的论文，一个国际研究小组首次成功地在大气条件下检测到了氢三氧化物（ROOOH）。这是一种全新的化合物，可能会影响人类健康和全球气候。 所有的过氧化物都有两个相互连接的氧原子，使它们具有高反应性并且通常易燃易爆。它们被用于各种用途，从美白牙齿到清理伤口，甚至用作火箭燃料。近年来，人们一直在猜测，大气中是否也发现了三氧化物——三个氧原子相互连接的化合物，比过氧化氢更具活性。 科学家最新研究明确证实，在大气条件下，过氧化氢自由基（RO2）和羟基自由基（OH）的反应也会形成ROOOH。当化合物在大气中被氧化时，它们通常会与OH自由基发生反应，形成新的自由基。当该自由基与氧反应时，会形成过氧化物（ROO）的第三个自由基，该自由基又可以与OH自由基反应，从而形成ROOOH。这是气态物质，其基团由三个连续的氧原子和一个氢原子组成，氢原子与有机残基键合。 研究论文资深作者、丹麦哥本哈根大学化学系亨里克·格鲁姆·吉尔嘉德教授说：“我们发现的这类化合物在结构上是独一无二的。由于它们具有极强的氧化性，很可能会带来一系列我们尚未发现的影响。” 研究人员预计，几乎所有化合物都会在大气中形成ROOOH，并估计它们的寿命从几分钟到几小时不等。这使得它们足够稳定，可与许多其他大气化合物发生反应。异戊二烯是最常排放到大气中的有机化合物之一。研究表明，释放的所有异戊二烯中约有1%转化为ROOOH。 研究人员估计，大气中ROOOH的浓度约为每立方厘米1000万。相比之下，OH自由基是大气中最重要的氧化剂之一，每立方厘米约有100万个自由基。 研究团队还强烈怀疑，ROOOH能够渗透到空气中的微小颗粒物，即所谓的气溶胶中，这种颗粒物会对健康构成危害，并可能导致呼吸系统和心血管疾病。由于太阳光同时被气溶胶反射和吸收，这会影响地球的热平衡，也就是地球吸收并反射回太空的阳光比例。当气溶胶吸收物质时，它们会增长并促成云层的形成，这也会影响地球的气候。 研究表明，用质谱仪直接观察氢三氧化物是可行的。这意味着可在不同系统中进一步研究这些化合物，包括量化它们在环境中的丰度。（实习记者张佳欣）                                                                                                                    
http://society.people.com.cn/n1/2022/0530/c1008-32433531.html,湖南：实行台账管理 保障办案质量,本报讯 （记者 陶 琛 通讯员 佟锡龙）近日，湖南省高级人民法院召开新闻发布会，通报全省法院打击涉养老诈骗犯罪专项行动开展情况及全省第一批集中宣判的情况，并发布4起典型案例。今年以来，全省法院审结涉养老诈骗案件54件256人，判处五年以上十年以下有期徒刑56人，十年以上有期徒刑8人，对8名被告人判处无期徒刑。 自打击整治养老诈骗专项行动开展以来，湖南高院第一时间成立全省法院打击整治养老诈骗专项行动领导小组。全省法院将办案质量作为生命线，坚定落实“稳、准、狠”要求，严格把好案件事实关、证据关、程序关和法律适用关。对养老诈骗案件实行台账管理，每周一通报，半月一督办，推行院庭长承办和包案机制，对重点案件倒排工期、限期结案。组建“审判+执行”专班，将追赃挽损贯穿案件处置全过程，对养老诈骗案件优先办理，所有判决生效案件均在规定时限内移送执行。今年以来，全省法院追赃挽损执行到位金额3700余万元。 全省法院积极延伸审判职能，及时向有关部门发出30份司法建议。构建“传统宣传+新媒体平台”集成发力、线上线下矩阵联动，进社区、下村寨“接地气”的涉养老诈骗宣传普法大格局，开展现场反诈宣传220余场次，发放宣传资料3万余册。                                                                                                                    
